cps_pp/tests/eofa_eig_range/run/work/tunecache.tsv
tunecache	0.9.1	v0.9.0-1231-ga824b14-sm_70	cpu_arch=ppc64le,gpu_arch=sm_70,cuda_version=9020	# Last updated Mon May 13 12:00:32 2019

          volume	name	aux	block.x	block.y	block.z	grid.x	grid.y	grid.z	shared_bytes	aux.x	aux.y	aux.z	aux.w	time	comment
     16x16x16x16	N4quda12ExtractGhostIdLi18ELi4ENS_5gauge11FloatNOrderIdLi18ELi2ELi18EL20QudaStaggeredPhase_s0ELb1EL19QudaGhostExchange_sn2147483648ELb0EEEEE	stride=34816	128	1	1	32	1	8	3277	1	1	1	1	1.2064e-05	# 0.00 Gflop/s, 391.13 GB/s, tuning took 0.040137 seconds at Mon May 13 11:57:42 2019
     16x16x16x16	N4quda9CopyGaugeIddLi18ENS_12CopyGaugeArgINS_5gauge11FloatNOrderIdLi18ELi2ELi18EL20QudaStaggeredPhase_s0ELb1EL19QudaGhostExchange_sn2147483648ELb0EEENS2_8CPSOrderIdLi18EEEEEEE	GPU-offline,out:vol=65536,stride=34816,precision=8,geometry=4,Nc=3,in:vol=65536,stride=32768,precision=8,geometry=4,Nc=3	64	1	4	512	1	2	0	1	1	1	1	0.000108864	# 0.00 Gflop/s, 693.50 GB/s, tuning took 0.145814 seconds at Mon May 13 11:57:42 2019
     16x16x16x16	N4quda9CopyGaugeIddLi18ENS_12CopyGaugeArgINS_5gauge11FloatNOrderIdLi18ELi2ELi18EL20QudaStaggeredPhase_s0ELb1EL19QudaGhostExchange_sn2147483648ELb0EEES6_EEEE	GPU-offline,out:vol=65536,stride=34816,precision=8,geometry=4,Nc=3,in:vol=65536,stride=34816,precision=8,geometry=4,Nc=3,ghost	64	1	8	32	1	1	24577	1	1	1	1	8.224e-06	# 0.00 Gflop/s, 573.76 GB/s, tuning took 0.034900 seconds at Mon May 13 11:57:42 2019
     16x16x16x16	N4quda9CopyGaugeIsdLi18ENS_12CopyGaugeArgINS_5gauge11FloatNOrderIsLi18ELi2ELi18EL20QudaStaggeredPhase_s0ELb1EL19QudaGhostExchange_sn2147483648ELb0EEENS3_IdLi18ELi2ELi18ELS4_0ELb1ELS5_n2147483648ELb0EEEEEEE	GPU-offline,out:vol=65536,stride=34816,precision=2,geometry=4,Nc=3,in:vol=65536,stride=34816,precision=8,geometry=4,Nc=3	224	1	3	147	1	3	0	1	1	1	1	6.2144e-05	# 0.00 Gflop/s, 759.30 GB/s, tuning took 0.100378 seconds at Mon May 13 11:57:42 2019
     16x16x16x16	N4quda9CopyGaugeIsdLi18ENS_12CopyGaugeArgINS_5gauge11FloatNOrderIsLi18ELi2ELi18EL20QudaStaggeredPhase_s0ELb1EL19QudaGhostExchange_sn2147483648ELb0EEENS3_IdLi18ELi2ELi18ELS4_0ELb1ELS5_n2147483648ELb0EEEEEEE	GPU-offline,out:vol=65536,stride=34816,precision=2,geometry=4,Nc=3,in:vol=65536,stride=34816,precision=8,geometry=4,Nc=3,ghost	32	1	1	64	1	8	2587	1	1	1	1	8.064e-06	# 0.00 Gflop/s, 365.71 GB/s, tuning took 0.034018 seconds at Mon May 13 11:57:42 2019
  16x16x16x16x16	N4quda15CopyColorSpinorIddLi4ELi3ENS_18CopyColorSpinorArgINS_11colorspinor11FloatNOrderIdLi4ELi3ELi2ELb0ELb0EEENS2_21SpaceSpinorColorOrderIdLi4ELi3EEEEEEE	out_stride=524288,in_stride=524288,NonRelBasis	704	1	1	745	2	1	0	1	1	1	1	0.00051376	# 0.00 Gflop/s, 783.74 GB/s, tuning took 0.046596 seconds at Mon May 13 11:57:42 2019
  16x16x16x16x16	N4quda15CopyColorSpinorIddLi4ELi3ENS_18CopyColorSpinorArgINS_11colorspinor21SpaceSpinorColorOrderIdLi4ELi3EEENS2_11FloatNOrderIdLi4ELi3ELi2ELb0ELb0EEEEEEE	out_stride=524288,in_stride=524288,RelBasis	32	1	1	16384	2	1	0	0	1	0	1	0.000501632	# 0.00 Gflop/s, 802.69 GB/s, tuning took 0.046264 seconds at Mon May 13 12:00:27 2019
  16x16x16x16x16	N4quda4blas5Norm2Id7double2S2_EE	vol=1048576,stride=524288,precision=8,Ns=4,Nc=3	608	1	1	120	2	1	0	1	1	1	1	0.000246379	# 204.29 Gflop/s, 817.14 GB/s, tuning took 10.577294 seconds at Mon May 13 11:57:53 2019
   8x16x16x16x16	11N4quda4blas11multicaxpy_ILi1E7double2S2_EE	vol=524288,stride=524288,precision=2,Ns=4,Nc=3,vol=524288,stride=524288,precision=8,Ns=4,Nc=3	416	1	1	158	1	1	0	0	1	0	1	0.000289088	# 174.10 Gflop/s, 783.47 GB/s, tuning took 8.745942 seconds at Mon May 13 11:59:51 2019
   8x16x16x16x16	N4quda11mobius_eofa7Dslash5IdLi3ENS0_10Dslash5ArgIdLi3EEEEE	vol=524288,stride=524288,precision=8,Ns=4,Nc=3,Dagger,eofa_minus,mobius_M5INV_EOFA	8	16	1	4096	1	1	24576	6	2	0	1	0.000295168	# 175.85 Gflop/s, 1023.11 GB/s, tuning took 0.019065 seconds at Mon May 13 11:58:43 2019
   8x16x16x16x16	N4quda11mobius_eofa7Dslash5IdLi3ENS0_10Dslash5ArgIdLi3EEEEE	vol=524288,stride=524288,precision=8,Ns=4,Nc=3,Dagger,eofa_plus,mobius_M5INV_EOFA	8	16	1	4096	1	1	24576	0	1	0	1	0.00029024	# 178.83 Gflop/s, 1040.48 GB/s, tuning took 0.019569 seconds at Mon May 13 12:00:29 2019
   8x16x16x16x16	N4quda11mobius_eofa7Dslash5IdLi3ENS0_10Dslash5ArgIdLi3EEEEE	vol=524288,stride=524288,precision=8,Ns=4,Nc=3,Dagger,xpay,eofa_minus,mobius_M5_EOFA	32	16	1	1024	1	1	98304	6	2	0	1	0.000381632	# 201.95 Gflop/s, 1055.08 GB/s, tuning took 0.021388 seconds at Mon May 13 11:58:43 2019
   8x16x16x16x16	N4quda11mobius_eofa7Dslash5IdLi3ENS0_10Dslash5ArgIdLi3EEEEE	vol=524288,stride=524288,precision=8,Ns=4,Nc=3,Dagger,xpay,eofa_plus,mobius_M5_EOFA	32	16	1	1024	1	1	98304	0	1	0	1	0.000378656	# 203.54 Gflop/s, 1063.37 GB/s, tuning took 0.021042 seconds at Mon May 13 12:00:29 2019
   8x16x16x16x16	N4quda11mobius_eofa7Dslash5IdLi3ENS0_10Dslash5ArgIdLi3EEEEE	vol=524288,stride=524288,precision=8,Ns=4,Nc=3,eofa_minus,mobius_M5INV_EOFA	8	16	1	4096	1	1	24576	1	1	1	1	0.000301152	# 172.35 Gflop/s, 1002.78 GB/s, tuning took 0.019041 seconds at Mon May 13 11:57:53 2019
   8x16x16x16x16	N4quda11mobius_eofa7Dslash5IdLi3ENS0_10Dslash5ArgIdLi3EEEEE	vol=524288,stride=524288,precision=8,Ns=4,Nc=3,eofa_plus,mobius_M5INV_EOFA	8	16	1	4096	1	1	24576	0	1	0	1	0.000303776	# 170.86 Gflop/s, 994.12 GB/s, tuning took 0.019292 seconds at Mon May 13 12:00:29 2019
   8x16x16x16x16	N4quda11mobius_eofa7Dslash5IdLi3ENS0_10Dslash5ArgIdLi3EEEEE	vol=524288,stride=524288,precision=8,Ns=4,Nc=3,xpay,eofa_minus,mobius_M5_EOFA	32	16	1	1024	1	1	98304	6	2	0	1	0.000376032	# 204.96 Gflop/s, 1070.80 GB/s, tuning took 0.020486 seconds at Mon May 13 11:58:50 2019
   8x16x16x16x16	N4quda11mobius_eofa7Dslash5IdLi3ENS0_10Dslash5ArgIdLi3EEEEE	vol=524288,stride=524288,precision=8,Ns=4,Nc=3,xpay,eofa_plus,mobius_M5_EOFA	32	16	1	1024	1	1	98304	0	1	0	1	0.000376928	# 204.47 Gflop/s, 1068.25 GB/s, tuning took 0.021235 seconds at Mon May 13 12:00:29 2019
   8x16x16x16x16	N4quda11mobius_eofa7Dslash5IsLi3ENS0_10Dslash5ArgIsLi3EEEEE	vol=524288,stride=524288,precision=2,Ns=4,Nc=3,Dagger,eofa_minus,mobius_M5INV_EOFA	16	16	1	2048	1	1	24576	0	1	0	1	0.000159008	# 326.43 Gflop/s, 514.37 GB/s, tuning took 0.022870 seconds at Mon May 13 11:59:29 2019
   8x16x16x16x16	N4quda11mobius_eofa7Dslash5IsLi3ENS0_10Dslash5ArgIsLi3EEEEE	vol=524288,stride=524288,precision=2,Ns=4,Nc=3,Dagger,eofa_plus,mobius_M5INV_EOFA	8	16	1	4096	1	1	12289	0	1	0	1	0.000158368	# 327.75 Gflop/s, 516.45 GB/s, tuning took 0.023091 seconds at Mon May 13 12:00:29 2019
   8x16x16x16x16	N4quda11mobius_eofa7Dslash5IsLi3ENS0_10Dslash5ArgIsLi3EEEEE	vol=524288,stride=524288,precision=2,Ns=4,Nc=3,Dagger,xpay,eofa_minus,mobius_M5_EOFA	32	16	1	1024	1	1	49152	0	1	0	1	0.000108672	# 709.20 Gflop/s, 1003.50 GB/s, tuning took 0.019054 seconds at Mon May 13 11:59:29 2019
   8x16x16x16x16	N4quda11mobius_eofa7Dslash5IsLi3ENS0_10Dslash5ArgIsLi3EEEEE	vol=524288,stride=524288,precision=2,Ns=4,Nc=3,Dagger,xpay,eofa_plus,mobius_M5_EOFA	16	16	1	2048	1	1	24576	0	1	0	1	0.000111744	# 689.70 Gflop/s, 975.91 GB/s, tuning took 0.018969 seconds at Mon May 13 12:00:29 2019
   8x16x16x16x16	N4quda11mobius_eofa7Dslash5IsLi3ENS0_10Dslash5ArgIsLi3EEEEE	vol=524288,stride=524288,precision=2,Ns=4,Nc=3,eofa_minus,mobius_M5INV_EOFA	16	16	1	2048	1	1	24576	0	1	0	1	0.000158432	# 327.61 Gflop/s, 516.24 GB/s, tuning took 0.023087 seconds at Mon May 13 11:59:19 2019
   8x16x16x16x16	N4quda11mobius_eofa7Dslash5IsLi3ENS0_10Dslash5ArgIsLi3EEEEE	vol=524288,stride=524288,precision=2,Ns=4,Nc=3,eofa_plus,mobius_M5INV_EOFA	8	16	1	4096	1	1	16385	0	1	0	1	0.000163648	# 317.17 Gflop/s, 499.79 GB/s, tuning took 0.023976 seconds at Mon May 13 12:00:29 2019
   8x16x16x16x16	N4quda11mobius_eofa7Dslash5IsLi3ENS0_10Dslash5ArgIsLi3EEEEE	vol=524288,stride=524288,precision=2,Ns=4,Nc=3,xpay,eofa_minus,mobius_M5_EOFA	32	16	1	1024	1	1	49152	0	1	0	1	0.00010736	# 717.87 Gflop/s, 1015.76 GB/s, tuning took 0.017897 seconds at Mon May 13 11:59:19 2019
   8x16x16x16x16	N4quda11mobius_eofa7Dslash5IsLi3ENS0_10Dslash5ArgIsLi3EEEEE	vol=524288,stride=524288,precision=2,Ns=4,Nc=3,xpay,eofa_plus,mobius_M5_EOFA	32	16	1	1024	1	1	49152	0	1	0	1	0.000107936	# 714.04 Gflop/s, 1010.34 GB/s, tuning took 0.017653 seconds at Mon May 13 12:00:29 2019
   8x16x16x16x16	N4quda12DomainWall4DIdLi4ELi3ENS_15DomainWall4DArgIdLi3EL21QudaReconstructType_s18EEEEE	policy,commDim=0001,dagger,topo=1112,p2p=3,gdr=0	32	1	1	1	1	1	0	6	2	0	1	0.000696938	# 993.00 Gflop/s, 2022.11 GB/s, tuning took 0.181490 seconds at Mon May 13 11:58:37 2019
   8x16x16x16x16	N4quda12DomainWall4DIdLi4ELi3ENS_15DomainWall4DArgIdLi3EL21QudaReconstructType_s18EEEEE	policy,commDim=0001,topo=1112,p2p=3,gdr=0	32	1	1	1	1	1	0	6	2	0	1	0.000689254	# 1004.07 Gflop/s, 2044.65 GB/s, tuning took 0.178237 seconds at Mon May 13 11:58:50 2019
   8x16x16x16x16	N4quda12DomainWall4DIdLi4ELi3ENS_15DomainWall4DArgIdLi3EL21QudaReconstructType_s18EEEEE	policy,commDim=0001,xpay,topo=1112,p2p=3,gdr=0	32	1	1	1	1	1	0	6	2	0	1	0.000916787	# 782.33 Gflop/s, 1537.20 GB/s, tuning took 0.202317 seconds at Mon May 13 11:58:14 2019
   8x16x16x16x16	N4quda12DomainWall4DIdLi4ELi3ENS_15DomainWall4DArgIdLi3EL21QudaReconstructType_s18EEEEE	policy_kernel=exterior_all,commDim=0001	32	4	1	128	4	1	3277	6	2	0	1	5.35424e-05	# 220.32 Gflop/s, 763.78 GB/s, tuning took 0.283573 seconds at Mon May 13 11:58:49 2019
   8x16x16x16x16	N4quda12DomainWall4DIdLi4ELi3ENS_15DomainWall4DArgIdLi3EL21QudaReconstructType_s18EEEEE	policy_kernel=exterior_all,commDim=0001,dagger	32	4	1	128	4	1	12289	6	2	0	1	5.37888e-05	# 219.31 Gflop/s, 760.28 GB/s, tuning took 0.285857 seconds at Mon May 13 11:58:30 2019
   8x16x16x16x16	N4quda12DomainWall4DIdLi4ELi3ENS_15DomainWall4DArgIdLi3EL21QudaReconstructType_s18EEEEE	policy_kernel=exterior_all,commDim=0001,dagger,zero_copy	32	1	1	128	16	1	24577	6	2	0	1	0.000111978	# 105.35 Gflop/s, 365.20 GB/s, tuning took 0.535955 seconds at Mon May 13 11:58:31 2019
   8x16x16x16x16	N4quda12DomainWall4DIdLi4ELi3ENS_15DomainWall4DArgIdLi3EL21QudaReconstructType_s18EEEEE	policy_kernel=exterior_all,commDim=0001,xpay	96	1	1	43	16	1	4097	1	1	1	1	5.43424e-05	# 246.02 Gflop/s, 752.53 GB/s, tuning took 0.284652 seconds at Mon May 13 11:58:07 2019
   8x16x16x16x16	N4quda12DomainWall4DIdLi4ELi3ENS_15DomainWall4DArgIdLi3EL21QudaReconstructType_s18EEEEE	policy_kernel=exterior_all,commDim=0001,xpay,zero_copy	32	7	1	128	3	1	9831	1	1	1	1	0.000111907	# 119.47 Gflop/s, 365.43 GB/s, tuning took 0.535941 seconds at Mon May 13 11:58:08 2019
   8x16x16x16x16	N4quda12DomainWall4DIdLi4ELi3ENS_15DomainWall4DArgIdLi3EL21QudaReconstructType_s18EEEEE	policy_kernel=exterior_all,commDim=0001,zero_copy	96	3	1	43	6	1	0	6	2	0	1	0.00011057	# 106.69 Gflop/s, 369.85 GB/s, tuning took 0.531277 seconds at Mon May 13 11:58:50 2019
   8x16x16x16x16	N4quda12DomainWall4DIdLi4ELi3ENS_15DomainWall4DArgIdLi3EL21QudaReconstructType_s18EEEEE	policy_kernel=exterior_t,commDim=0001	32	16	1	128	1	1	16385	6	2	0	1	4.87776e-05	# 241.84 Gflop/s, 838.39 GB/s, tuning took 0.292449 seconds at Mon May 13 11:58:48 2019
   8x16x16x16x16	N4quda12DomainWall4DIdLi4ELi3ENS_15DomainWall4DArgIdLi3EL21QudaReconstructType_s18EEEEE	policy_kernel=exterior_t,commDim=0001,dagger	32	8	1	128	2	1	9831	6	2	0	1	4.92128e-05	# 239.70 Gflop/s, 830.97 GB/s, tuning took 0.295729 seconds at Mon May 13 11:58:30 2019
   8x16x16x16x16	N4quda12DomainWall4DIdLi4ELi3ENS_15DomainWall4DArgIdLi3EL21QudaReconstructType_s18EEEEE	policy_kernel=exterior_t,commDim=0001,dagger,zero_copy	32	14	1	128	2	1	24577	6	2	0	1	0.000109731	# 107.50 Gflop/s, 372.68 GB/s, tuning took 0.604121 seconds at Mon May 13 11:58:31 2019
   8x16x16x16x16	N4quda12DomainWall4DIdLi4ELi3ENS_15DomainWall4DArgIdLi3EL21QudaReconstructType_s18EEEEE	policy_kernel=exterior_t,commDim=0001,xpay	32	3	1	128	6	1	5462	1	1	1	1	4.95776e-05	# 269.67 Gflop/s, 824.86 GB/s, tuning took 0.294804 seconds at Mon May 13 11:58:07 2019
   8x16x16x16x16	N4quda12DomainWall4DIdLi4ELi3ENS_15DomainWall4DArgIdLi3EL21QudaReconstructType_s18EEEEE	policy_kernel=exterior_t,commDim=0001,xpay,zero_copy	32	14	1	128	2	1	24577	1	1	1	1	0.000109171	# 122.46 Gflop/s, 374.59 GB/s, tuning took 0.604509 seconds at Mon May 13 11:58:08 2019
   8x16x16x16x16	N4quda12DomainWall4DIdLi4ELi3ENS_15DomainWall4DArgIdLi3EL21QudaReconstructType_s18EEEEE	policy_kernel=exterior_t,commDim=0001,zero_copy	32	14	1	128	2	1	12289	6	2	0	1	0.000109373	# 107.86 Gflop/s, 373.90 GB/s, tuning took 0.603442 seconds at Mon May 13 11:58:49 2019
   8x16x16x16x16	N4quda12DomainWall4DIdLi4ELi3ENS_15DomainWall4DArgIdLi3EL21QudaReconstructType_s18EEEEE	policy_kernel=interior,comm=0001,commDim=0001	32	9	1	1024	2	1	9831	6	2	0	1	0.00061295	# 1112.38 Gflop/s, 2232.47 GB/s, tuning took 5.228328 seconds at Mon May 13 11:58:48 2019
   8x16x16x16x16	N4quda12DomainWall4DIdLi4ELi3ENS_15DomainWall4DArgIdLi3EL21QudaReconstructType_s18EEEEE	policy_kernel=interior,comm=0001,commDim=0001,dagger	32	8	1	1024	2	1	9831	6	2	0	1	0.000611642	# 1114.76 Gflop/s, 2237.24 GB/s, tuning took 5.144980 seconds at Mon May 13 11:58:30 2019
   8x16x16x16x16	N4quda12DomainWall4DIdLi4ELi3ENS_15DomainWall4DArgIdLi3EL21QudaReconstructType_s18EEEEE	policy_kernel=interior,comm=0001,commDim=0001,xpay	32	10	1	1024	2	1	12289	1	1	1	1	0.000829238	# 852.59 Gflop/s, 1650.18 GB/s, tuning took 5.829646 seconds at Mon May 13 11:58:07 2019
   8x16x16x16x16	N4quda12DomainWall4DIsLi4ELi3ENS_15DomainWall4DArgIsLi3EL21QudaReconstructType_s18EEEEE	policy,commDim=0001,dagger,topo=1112,p2p=3,gdr=0	32	1	1	1	1	1	0	0	1	0	1	0.000268214	# 2580.25 Gflop/s, 1376.13 GB/s, tuning took 0.065324 seconds at Mon May 13 11:59:26 2019
   8x16x16x16x16	N4quda12DomainWall4DIsLi4ELi3ENS_15DomainWall4DArgIsLi3EL21QudaReconstructType_s18EEEEE	policy,commDim=0001,topo=1112,p2p=3,gdr=0	32	1	1	1	1	1	0	0	1	0	1	0.000264352	# 2617.95 Gflop/s, 1396.24 GB/s, tuning took 0.066305 seconds at Mon May 13 11:59:19 2019
   8x16x16x16x16	N4quda12DomainWall4DIsLi4ELi3ENS_15DomainWall4DArgIsLi3EL21QudaReconstructType_s18EEEEE	policy_kernel=exterior_all,commDim=0001	224	2	1	19	8	1	12289	6	2	0	1	1.60928e-05	# 733.03 Gflop/s, 676.02 GB/s, tuning took 0.143099 seconds at Mon May 13 11:59:16 2019
   8x16x16x16x16	N4quda12DomainWall4DIsLi4ELi3ENS_15DomainWall4DArgIsLi3EL21QudaReconstructType_s18EEEEE	policy_kernel=exterior_all,commDim=0001,dagger	224	2	1	19	8	1	0	0	1	0	1	1.55072e-05	# 760.71 Gflop/s, 701.54 GB/s, tuning took 0.138714 seconds at Mon May 13 11:59:23 2019
   8x16x16x16x16	N4quda12DomainWall4DIsLi4ELi3ENS_15DomainWall4DArgIsLi3EL21QudaReconstructType_s18EEEEE	policy_kernel=exterior_all,commDim=0001,dagger,zero_copy	32	3	1	128	6	1	24577	0	1	0	1	4.14752e-05	# 284.42 Gflop/s, 262.30 GB/s, tuning took 0.294184 seconds at Mon May 13 11:59:23 2019
   8x16x16x16x16	N4quda12DomainWall4DIsLi4ELi3ENS_15DomainWall4DArgIsLi3EL21QudaReconstructType_s18EEEEE	policy_kernel=exterior_all,commDim=0001,zero_copy	32	2	1	128	8	1	24577	6	2	0	1	4.13856e-05	# 285.04 Gflop/s, 262.87 GB/s, tuning took 0.291325 seconds at Mon May 13 11:59:16 2019
   8x16x16x16x16	N4quda12DomainWall4DIsLi4ELi3ENS_15DomainWall4DArgIsLi3EL21QudaReconstructType_s18EEEEE	policy_kernel=exterior_t,commDim=0001	32	15	1	128	2	1	24577	6	2	0	1	1.4e-05	# 842.61 Gflop/s, 777.07 GB/s, tuning took 0.134208 seconds at Mon May 13 11:59:16 2019
   8x16x16x16x16	N4quda12DomainWall4DIsLi4ELi3ENS_15DomainWall4DArgIsLi3EL21QudaReconstructType_s18EEEEE	policy_kernel=exterior_t,commDim=0001,dagger	32	2	1	128	8	1	2731	0	1	0	1	1.40352e-05	# 840.49 Gflop/s, 775.12 GB/s, tuning took 0.129612 seconds at Mon May 13 11:59:23 2019
   8x16x16x16x16	N4quda12DomainWall4DIsLi4ELi3ENS_15DomainWall4DArgIsLi3EL21QudaReconstructType_s18EEEEE	policy_kernel=exterior_t,commDim=0001,dagger,zero_copy	32	1	1	128	16	1	16385	0	1	0	1	3.94496e-05	# 299.03 Gflop/s, 275.77 GB/s, tuning took 0.290011 seconds at Mon May 13 11:59:23 2019
   8x16x16x16x16	N4quda12DomainWall4DIsLi4ELi3ENS_15DomainWall4DArgIsLi3EL21QudaReconstructType_s18EEEEE	policy_kernel=exterior_t,commDim=0001,zero_copy	32	1	1	128	16	1	16385	6	2	0	1	3.95616e-05	# 298.18 Gflop/s, 274.99 GB/s, tuning took 0.289841 seconds at Mon May 13 11:59:16 2019
   8x16x16x16x16	N4quda12DomainWall4DIsLi4ELi3ENS_15DomainWall4DArgIsLi3EL21QudaReconstructType_s18EEEEE	policy_kernel=interior,comm=0001,commDim=0001	32	12	1	1024	2	1	12289	6	2	0	1	0.000220544	# 3091.61 Gflop/s, 1624.26 GB/s, tuning took 1.701073 seconds at Mon May 13 11:59:16 2019
   8x16x16x16x16	N4quda12DomainWall4DIsLi4ELi3ENS_15DomainWall4DArgIsLi3EL21QudaReconstructType_s18EEEEE	policy_kernel=interior,comm=0001,commDim=0001,dagger	32	10	1	1024	2	1	24577	0	1	0	1	0.000217104	# 3140.60 Gflop/s, 1649.99 GB/s, tuning took 1.704425 seconds at Mon May 13 11:59:23 2019
   8x16x16x16x16	N4quda4PackIdLi3EEE	policy_kernel,vol=524288,stride=524288,precision=8,Ns=4,Nc=3,comm=0001,topo=1112,dagger,kernelPackT,nFace=1,device-device	32	4	1	64	4	1	0	6	2	0	1	2.02133e-05	# 38.91 Gflop/s, 933.76 GB/s, tuning took 1.836509 seconds at Mon May 13 11:58:24 2019
   8x16x16x16x16	N4quda4PackIdLi3EEE	policy_kernel,vol=524288,stride=524288,precision=8,Ns=4,Nc=3,comm=0001,topo=1112,dagger,kernelPackT,nFace=1,device-remote	32	15	1	32	2	1	0	6	2	0	1	0.000100096	# 7.86 Gflop/s, 188.56 GB/s, tuning took 5.085021 seconds at Mon May 13 11:58:36 2019
   8x16x16x16x16	N4quda4PackIdLi3EEE	policy_kernel,vol=524288,stride=524288,precision=8,Ns=4,Nc=3,comm=0001,topo=1112,dagger,kernelPackT,nFace=1,host-device	384	1	1	3	16	1	24577	6	2	0	1	2.14933e-05	# 36.59 Gflop/s, 878.15 GB/s, tuning took 0.016019 seconds at Mon May 13 11:58:31 2019
   8x16x16x16x16	N4quda4PackIdLi3EEE	policy_kernel,vol=524288,stride=524288,precision=8,Ns=4,Nc=3,comm=0001,topo=1112,dagger,kernelPackT,nFace=1,host-host	640	1	1	3	16	1	24577	6	2	0	1	0.000143659	# 5.47 Gflop/s, 131.38 GB/s, tuning took 0.054850 seconds at Mon May 13 11:58:30 2019
   8x16x16x16x16	N4quda4PackIdLi3EEE	policy_kernel,vol=524288,stride=524288,precision=8,Ns=4,Nc=3,comm=0001,topo=1112,dagger,kernelPackT,nFace=1,host-remote	128	3	1	3	6	1	24577	6	2	0	1	0.000102699	# 7.66 Gflop/s, 183.78 GB/s, tuning took 0.032929 seconds at Mon May 13 11:58:37 2019
   8x16x16x16x16	N4quda4PackIdLi3EEE	policy_kernel,vol=524288,stride=524288,precision=8,Ns=4,Nc=3,comm=0001,topo=1112,kernelPackT,nFace=1,device-device	32	3	1	64	6	1	0	1	1	1	1	2.032e-05	# 38.70 Gflop/s, 928.86 GB/s, tuning took 1.849546 seconds at Mon May 13 11:58:01 2019
   8x16x16x16x16	N4quda4PackIdLi3EEE	policy_kernel,vol=524288,stride=524288,precision=8,Ns=4,Nc=3,comm=0001,topo=1112,kernelPackT,nFace=1,device-remote	32	15	1	32	2	1	0	1	1	1	1	0.00010064	# 7.81 Gflop/s, 187.54 GB/s, tuning took 5.094033 seconds at Mon May 13 11:58:13 2019
   8x16x16x16x16	N4quda4PackIdLi3EEE	policy_kernel,vol=524288,stride=524288,precision=8,Ns=4,Nc=3,comm=0001,topo=1112,kernelPackT,nFace=1,host-device	448	1	1	3	16	1	24577	1	1	1	1	2.15787e-05	# 36.44 Gflop/s, 874.68 GB/s, tuning took 0.016333 seconds at Mon May 13 11:58:08 2019
   8x16x16x16x16	N4quda4PackIdLi3EEE	policy_kernel,vol=524288,stride=524288,precision=8,Ns=4,Nc=3,comm=0001,topo=1112,kernelPackT,nFace=1,host-host	640	1	1	3	16	1	24577	1	1	1	1	0.000143115	# 5.50 Gflop/s, 131.88 GB/s, tuning took 0.051386 seconds at Mon May 13 11:58:07 2019
   8x16x16x16x16	N4quda4PackIdLi3EEE	policy_kernel,vol=524288,stride=524288,precision=8,Ns=4,Nc=3,comm=0001,topo=1112,kernelPackT,nFace=1,host-remote	128	2	1	3	8	1	24577	1	1	1	1	0.000102987	# 7.64 Gflop/s, 183.27 GB/s, tuning took 0.033234 seconds at Mon May 13 11:58:14 2019
   8x16x16x16x16	N4quda4PackIsLi3EEE	policy_kernel,vol=524288,stride=524288,precision=2,Ns=4,Nc=3,comm=0001,topo=1112,dagger,kernelPackT,nFace=1,device-device	64	2	1	65	8	1	0	0	1	0	1	6.89067e-06	# 114.13 Gflop/s, 760.87 GB/s, tuning took 1.405975 seconds at Mon May 13 11:59:21 2019
   8x16x16x16x16	N4quda4PackIsLi3EEE	policy_kernel,vol=524288,stride=524288,precision=2,Ns=4,Nc=3,comm=0001,topo=1112,dagger,kernelPackT,nFace=1,device-remote	576	1	1	64	16	1	0	0	1	0	1	3.344e-05	# 23.52 Gflop/s, 156.78 GB/s, tuning took 2.786447 seconds at Mon May 13 11:59:26 2019
   8x16x16x16x16	N4quda4PackIsLi3EEE	policy_kernel,vol=524288,stride=524288,precision=2,Ns=4,Nc=3,comm=0001,topo=1112,dagger,kernelPackT,nFace=1,host-device	480	1	1	3	16	1	24577	0	1	0	1	7.92533e-06	# 99.23 Gflop/s, 661.53 GB/s, tuning took 0.010741 seconds at Mon May 13 11:59:23 2019
   8x16x16x16x16	N4quda4PackIsLi3EEE	policy_kernel,vol=524288,stride=524288,precision=2,Ns=4,Nc=3,comm=0001,topo=1112,dagger,kernelPackT,nFace=1,host-host	736	1	1	3	16	1	24577	0	1	0	1	4.10667e-05	# 19.15 Gflop/s, 127.67 GB/s, tuning took 0.019533 seconds at Mon May 13 11:59:23 2019
   8x16x16x16x16	N4quda4PackIsLi3EEE	policy_kernel,vol=524288,stride=524288,precision=2,Ns=4,Nc=3,comm=0001,topo=1112,dagger,kernelPackT,nFace=1,host-remote	192	3	1	3	6	1	24577	0	1	0	1	3.77707e-05	# 20.82 Gflop/s, 138.81 GB/s, tuning took 0.017741 seconds at Mon May 13 11:59:26 2019
   8x16x16x16x16	N4quda4PackIsLi3EEE	policy_kernel,vol=524288,stride=524288,precision=2,Ns=4,Nc=3,comm=0001,topo=1112,kernelPackT,nFace=1,device-device	96	1	1	57	16	1	0	6	2	0	1	6.93333e-06	# 113.43 Gflop/s, 756.18 GB/s, tuning took 1.399078 seconds at Mon May 13 11:59:14 2019
   8x16x16x16x16	N4quda4PackIsLi3EEE	policy_kernel,vol=524288,stride=524288,precision=2,Ns=4,Nc=3,comm=0001,topo=1112,kernelPackT,nFace=1,device-remote	608	1	1	64	16	1	0	6	2	0	1	3.34613e-05	# 23.50 Gflop/s, 156.68 GB/s, tuning took 2.775642 seconds at Mon May 13 11:59:19 2019
   8x16x16x16x16	N4quda4PackIsLi3EEE	policy_kernel,vol=524288,stride=524288,precision=2,Ns=4,Nc=3,comm=0001,topo=1112,kernelPackT,nFace=1,host-device	352	1	1	3	16	1	24577	6	2	0	1	7.79733e-06	# 100.86 Gflop/s, 672.39 GB/s, tuning took 0.010759 seconds at Mon May 13 11:59:16 2019
   8x16x16x16x16	N4quda4PackIsLi3EEE	policy_kernel,vol=524288,stride=524288,precision=2,Ns=4,Nc=3,comm=0001,topo=1112,kernelPackT,nFace=1,host-host	768	1	1	3	16	1	24577	6	2	0	1	4.09813e-05	# 19.19 Gflop/s, 127.93 GB/s, tuning took 0.019621 seconds at Mon May 13 11:59:16 2019
   8x16x16x16x16	N4quda4PackIsLi3EEE	policy_kernel,vol=524288,stride=524288,precision=2,Ns=4,Nc=3,comm=0001,topo=1112,kernelPackT,nFace=1,host-remote	352	1	1	3	16	1	24577	6	2	0	1	3.76853e-05	# 20.87 Gflop/s, 139.12 GB/s, tuning took 0.017825 seconds at Mon May 13 11:59:19 2019
   8x16x16x16x16	N4quda4blas11axpbyzNorm2Id7double2S2_EE	vol=524288,stride=524288,precision=8,Ns=4,Nc=3	512	1	1	155	1	1	0	6	2	0	1	0.000379808	# 132.52 Gflop/s, 795.11 GB/s, tuning took 14.516184 seconds at Mon May 13 11:59:05 2019
   8x16x16x16x16	N4quda4blas11axpyCGNorm2I7double26float26float4EE	vol=524288,stride=524288,precision=2,Ns=4,Nc=3	576	1	1	76	1	1	0	0	1	0	1	0.000119979	# 629.26 Gflop/s, 629.26 GB/s, tuning took 4.577782 seconds at Mon May 13 11:59:37 2019
   8x16x16x16x16	N4quda4blas23HeavyQuarkResidualNorm_I7double37double2S3_EE	vol=524288,stride=524288,precision=8,Ns=4,Nc=3	192	1	1	156	1	1	0	0	1	0	1	0.000247147	# 203.65 Gflop/s, 814.60 GB/s, tuning took 7.836067 seconds at Mon May 13 12:00:27 2019
   8x16x16x16x16	N4quda4blas3DotId6float26float4EE	vol=524288,stride=524288,precision=2,Ns=4,Nc=3	256	1	1	150	1	1	0	0	1	0	1	8.1952e-05	# 307.08 Gflop/s, 614.16 GB/s, tuning took 3.373163 seconds at Mon May 13 11:59:32 2019
   8x16x16x16x16	N4quda4blas4CdotI7double26float26float4EE	vol=524288,stride=524288,precision=2,Ns=4,Nc=3	288	1	1	158	1	1	0	0	1	0	1	8.2112e-05	# 612.96 Gflop/s, 612.96 GB/s, tuning took 3.369644 seconds at Mon May 13 12:00:09 2019
   8x16x16x16x16	N4quda4blas5Norm2Id7double2S2_EE	vol=524288,stride=524288,precision=8,Ns=4,Nc=3	896	1	1	144	1	1	0	6	2	0	1	0.000134016	# 187.78 Gflop/s, 751.13 GB/s, tuning took 8.762024 seconds at Mon May 13 11:58:23 2019
   8x16x16x16x16	N4quda4blas6caxpy_I6float26float4EE	vol=524288,stride=524288,precision=2,Ns=4,Nc=3	576	1	1	72	1	1	0	0	1	0	1	0.000103019	# 488.57 Gflop/s, 732.85 GB/s, tuning took 3.954098 seconds at Mon May 13 12:00:13 2019
   8x16x16x16x16	N4quda4blas7axpbyz_I6float26float4EE	vol=524288,stride=524288,precision=2,Ns=4,Nc=3	736	1	1	141	1	1	0	0	1	0	1	0.000102944	# 366.69 Gflop/s, 733.38 GB/s, tuning took 3.982290 seconds at Mon May 13 12:00:17 2019
   8x16x16x16x16	N4quda4blas7axpbyz_I7double2S2_EE	vol=524288,stride=524288,precision=8,Ns=4,Nc=3	480	1	1	160	1	1	0	0	1	0	1	0.000361205	# 104.51 Gflop/s, 836.06 GB/s, tuning took 14.148133 seconds at Mon May 13 12:00:06 2019
   8x16x16x16x16	N4quda4blas9axpyZpbx_I7double2S2_EE	vol=524288,stride=524288,precision=2,Ns=4,Nc=3,vol=524288,stride=524288,precision=8,Ns=4,Nc=3	320	1	1	153	1	1	0	0	1	0	1	0.000354635	# 141.93 Gflop/s, 780.59 GB/s, tuning took 5.640983 seconds at Mon May 13 11:59:43 2019
   8x16x16x16x16	N4quda7Dslash5IdLi3ENS_10Dslash5ArgIdLi3EEEEE	vol=524288,stride=524288,precision=8,Ns=4,Nc=3,DSLASH5_MOBIUS_PRE	8	16	1	4096	1	1	5462	1	1	1	1	0.000269376	# 519.66 Gflop/s, 1494.76 GB/s, tuning took 6.131302 seconds at Mon May 13 11:57:59 2019
   8x16x16x16x16	N4quda7Dslash5IdLi3ENS_10Dslash5ArgIdLi3EEEEE	vol=524288,stride=524288,precision=8,Ns=4,Nc=3,Dagger,DSLASH5_MOBIUS_PRE	32	16	1	1024	1	1	0	6	2	0	1	0.000267392	# 523.52 Gflop/s, 1505.85 GB/s, tuning took 6.130210 seconds at Mon May 13 11:58:43 2019
   8x16x16x16x16	N4quda7Dslash5IsLi3ENS_10Dslash5ArgIsLi3EEEEE	vol=524288,stride=524288,precision=2,Ns=4,Nc=3,DSLASH5_MOBIUS_PRE	32	16	1	1024	1	1	0	6	2	0	1	7.9776e-05	# 1754.72 Gflop/s, 1366.98 GB/s, tuning took 2.690637 seconds at Mon May 13 11:59:12 2019
   8x16x16x16x16	N4quda7Dslash5IsLi3ENS_10Dslash5ArgIsLi3EEEEE	vol=524288,stride=524288,precision=2,Ns=4,Nc=3,Dagger,DSLASH5_MOBIUS_PRE	32	16	1	1024	1	1	0	0	1	0	1	8.0992e-05	# 1728.38 Gflop/s, 1346.45 GB/s, tuning took 2.696241 seconds at Mon May 13 11:59:29 2019
   8x16x16x16x16	copyKernel	dst=vol=524288,stride=524288,precision=2,Ns=4,Nc=3,src=vol=524288,stride=524288,precision=8,Ns=4,Nc=3	416	1	1	159	1	1	0	6	2	0	1	0.000159136	# 0.00 Gflop/s, 803.88 GB/s, tuning took 5.006146 seconds at Mon May 13 11:59:10 2019
 bytes=100663296	cudaMemcpyAsyncDeviceToDevice	copy,copy_quda.cu,133	32	1	1	1	1	1	0	6	2	0	1	0.00026016	# 0.00 Gflop/s, 773.86 GB/s, tuning took 0.000610 seconds at Mon May 13 11:58:23 2019
 bytes=201326592	cudaMemcpyDeviceToHost	saveSpinorField,cuda_color_spinor_field.cpp,694	32	1	1	1	1	1	0	0	1	0	1	0.0170488	# 0.00 Gflop/s, 11.81 GB/s, tuning took 0.038338 seconds at Mon May 13 12:00:28 2019
 bytes=201326592	cudaMemcpyHostToDevice	loadSpinorField,cuda_color_spinor_field.cpp,635	32	1	1	1	1	1	0	1	1	1	1	0.0162923	# 0.00 Gflop/s, 12.36 GB/s, tuning took 0.032648 seconds at Mon May 13 11:57:42 2019
   bytes=2097152	cudaMemcpyAsyncDeviceToDevice	copy,copy_quda.cu,135	32	1	1	1	1	1	0	6	2	0	1	2.2368e-05	# 0.00 Gflop/s, 187.51 GB/s, tuning took 0.000150 seconds at Mon May 13 11:59:10 2019
  bytes=25165824	cudaMemcpyAsyncDeviceToDevice	copy,copy_quda.cu,133	32	1	1	1	1	1	0	6	2	0	1	6.8224e-05	# 0.00 Gflop/s, 737.74 GB/s, tuning took 0.000367 seconds at Mon May 13 11:59:10 2019
  bytes=37748736	cudaMemcpyHostToDevice	copy,cuda_gauge_field.cpp,701	32	1	1	1	1	1	0	1	1	1	1	0.00317763	# 0.00 Gflop/s, 11.88 GB/s, tuning took 0.006551 seconds at Mon May 13 11:57:41 2019
    bytes=589824	cudaMemcpyDeviceToDevice	exchangeGhost,cuda_gauge_field.cpp,278	32	1	1	1	1	1	0	1	1	1	1	1.4432e-05	# 0.00 Gflop/s, 81.74 GB/s, tuning took 0.000087 seconds at Mon May 13 11:57:42 2019
